{"schema":"chancadem.index/v1","engine_version":"0.10.000","n_cases":2,"default_case":"FX01","cases":[{"case_id":"FX01","title":{"en":"Fixture: secondary cone at the choke optimum","es":"Fixture: cono secundario en el Ã³ptimo de alimentaciÃ³n atorada"},"category":{"en":"Secondary cone","es":"Cono secundario"},"real_or_synthetic":"synthetic","manifest_path":"manifests/FX01.json"},{"case_id":"FX02","title":{"en":"Fixture: HP500 survey 1","es":"Fixture: muestreo HP500 1"},"category":{"en":"Real surveys: Metso HP500 at Minas Rio","es":"Muestreos reales: Metso HP500 en Minas Rio"},"real_or_synthetic":"real","manifest_path":"manifests/FX02.json"}],"files":["models/surrogate.json","models/surrogate.onnx","models/surrogate.int8.onnx","models/psd-ae.json","models/psd-ae.onnx","hp500/backbone.json","hp500/loo.json","hp500/crusherbayes.json","model-metrics.json"]}