{"schema":"chancadem.index/v1","engine_version":"0.09.003","n_cases":27,"default_case":"S01","cases":[{"case_id":"CI1","title":{"en":"Setting above the feed top size, invalid control","es":"Abertura sobre el tamaño máximo, control inválido"},"category":{"en":"Controls","es":"Controles"},"real_or_synthetic":"synthetic","manifest_path":"manifests/CI1.json"},{"case_id":"CK1","title":{"en":"Calibration anchor, HP-class cone","es":"Ancla de calibración, cono de clase HP"},"category":{"en":"Controls","es":"Controles"},"real_or_synthetic":"synthetic","manifest_path":"manifests/CK1.json"},{"case_id":"CP1","title":{"en":"Pass-through, negative control","es":"Paso directo, control negativo"},"category":{"en":"Controls","es":"Controles"},"real_or_synthetic":"synthetic","manifest_path":"manifests/CP1.json"},{"case_id":"G01","title":{"en":"Gyratory primary, hard ore, run-of-mine feed","es":"Giratorio primario, mineral duro, alimentación a granel"},"category":{"en":"Primary crushing","es":"Chancado primario"},"real_or_synthetic":"synthetic","manifest_path":"manifests/G01.json"},{"case_id":"G02","title":{"en":"Gyratory primary, soft ore, high tonnage","es":"Giratorio primario, mineral blando, alto tonelaje"},"category":{"en":"Primary crushing","es":"Chancado primario"},"real_or_synthetic":"synthetic","manifest_path":"manifests/G02.json"},{"case_id":"H01","title":{"en":"Short-head tertiary, fine product","es":"Cabeza corta terciario, producto fino"},"category":{"en":"Tertiary crushing","es":"Chancado terciario"},"real_or_synthetic":"synthetic","manifest_path":"manifests/H01.json"},{"case_id":"H02","title":{"en":"Short-head tertiary, hard ore, choke feed","es":"Cabeza corta terciario, mineral duro, alimentación atorada"},"category":{"en":"Tertiary crushing","es":"Chancado terciario"},"real_or_synthetic":"synthetic","manifest_path":"manifests/H02.json"},{"case_id":"HP500-01","title":{"en":"HP500 survey 1: setting 54 mm, feed f80 88 mm","es":"Muestreo HP500 1: abertura 54 mm, f80 de alimentación 88 mm"},"category":{"en":"Real surveys: Metso HP500 at Minas Rio","es":"Muestreos reales: Metso HP500 en Minas Rio"},"real_or_synthetic":"real","manifest_path":"manifests/HP500-01.json"},{"case_id":"HP500-02","title":{"en":"HP500 survey 2: setting 54 mm, feed f80 84 mm","es":"Muestreo HP500 2: abertura 54 mm, f80 de alimentación 84 mm"},"category":{"en":"Real surveys: Metso HP500 at Minas Rio","es":"Muestreos reales: Metso HP500 en Minas Rio"},"real_or_synthetic":"real","manifest_path":"manifests/HP500-02.json"},{"case_id":"HP500-03","title":{"en":"HP500 survey 3: setting 48 mm, feed f80 47 mm","es":"Muestreo HP500 3: abertura 48 mm, f80 de alimentación 47 mm"},"category":{"en":"Real surveys: Metso HP500 at Minas Rio","es":"Muestreos reales: Metso HP500 en Minas Rio"},"real_or_synthetic":"real","manifest_path":"manifests/HP500-03.json"},{"case_id":"HP500-04","title":{"en":"HP500 survey 4: setting 48 mm, feed f80 88 mm","es":"Muestreo HP500 4: abertura 48 mm, f80 de alimentación 88 mm"},"category":{"en":"Real surveys: Metso HP500 at Minas Rio","es":"Muestreos reales: Metso HP500 en Minas Rio"},"real_or_synthetic":"real","manifest_path":"manifests/HP500-04.json"},{"case_id":"HP500-05","title":{"en":"HP500 survey 5: setting 48 mm, feed f80 62 mm","es":"Muestreo HP500 5: abertura 48 mm, f80 de alimentación 62 mm"},"category":{"en":"Real surveys: Metso HP500 at Minas Rio","es":"Muestreos reales: Metso HP500 en Minas Rio"},"real_or_synthetic":"real","manifest_path":"manifests/HP500-05.json"},{"case_id":"HP500-06","title":{"en":"HP500 survey 6: setting 40 mm, feed f80 79 mm","es":"Muestreo HP500 6: abertura 40 mm, f80 de alimentación 79 mm"},"category":{"en":"Real surveys: Metso HP500 at Minas Rio","es":"Muestreos reales: Metso HP500 en Minas Rio"},"real_or_synthetic":"real","manifest_path":"manifests/HP500-06.json"},{"case_id":"HP500-07","title":{"en":"HP500 survey 7: setting 38 mm, feed f80 140 mm","es":"Muestreo HP500 7: abertura 38 mm, f80 de alimentación 140 mm"},"category":{"en":"Real surveys: Metso HP500 at Minas Rio","es":"Muestreos reales: Metso HP500 en Minas Rio"},"real_or_synthetic":"real","manifest_path":"manifests/HP500-07.json"},{"case_id":"HP500-08","title":{"en":"HP500 survey 8: setting 44 mm, feed f80 123 mm","es":"Muestreo HP500 8: abertura 44 mm, f80 de alimentación 123 mm"},"category":{"en":"Real surveys: Metso HP500 at Minas Rio","es":"Muestreos reales: Metso HP500 en Minas Rio"},"real_or_synthetic":"real","manifest_path":"manifests/HP500-08.json"},{"case_id":"HP500-09","title":{"en":"HP500 survey 9: setting 40 mm, feed f80 81 mm","es":"Muestreo HP500 9: abertura 40 mm, f80 de alimentación 81 mm"},"category":{"en":"Real surveys: Metso HP500 at Minas Rio","es":"Muestreos reales: Metso HP500 en Minas Rio"},"real_or_synthetic":"real","manifest_path":"manifests/HP500-09.json"},{"case_id":"HP500-10","title":{"en":"HP500 survey 10: setting 55 mm, feed f80 81 mm","es":"Muestreo HP500 10: abertura 55 mm, f80 de alimentación 81 mm"},"category":{"en":"Real surveys: Metso HP500 at Minas Rio","es":"Muestreos reales: Metso HP500 en Minas Rio"},"real_or_synthetic":"real","manifest_path":"manifests/HP500-10.json"},{"case_id":"J01","title":{"en":"Jaw primary, hard ore, run-of-mine feed","es":"Mandíbulas primario, mineral duro, alimentación a granel"},"category":{"en":"Primary crushing","es":"Chancado primario"},"real_or_synthetic":"synthetic","manifest_path":"manifests/J01.json"},{"case_id":"J02","title":{"en":"Jaw primary, medium ore, trickle feed","es":"Mandíbulas primario, mineral medio, alimentación a goteo"},"category":{"en":"Primary crushing","es":"Chancado primario"},"real_or_synthetic":"synthetic","manifest_path":"manifests/J02.json"},{"case_id":"S01","title":{"en":"Cone secondary, medium ore, choke feed","es":"Cono secundario, mineral medio, alimentación atorada"},"category":{"en":"Secondary cone","es":"Cono secundario"},"real_or_synthetic":"synthetic","manifest_path":"manifests/S01.json"},{"case_id":"S02","title":{"en":"Cone secondary, soft ore, coarse feed","es":"Cono secundario, mineral blando, alimentación gruesa"},"category":{"en":"Secondary cone","es":"Cono secundario"},"real_or_synthetic":"synthetic","manifest_path":"manifests/S02.json"},{"case_id":"S03","title":{"en":"Cone secondary, hard ore, over-speed","es":"Cono secundario, mineral duro, sobrevelocidad"},"category":{"en":"Secondary cone","es":"Cono secundario"},"real_or_synthetic":"synthetic","manifest_path":"manifests/S03.json"},{"case_id":"S04","title":{"en":"Cone secondary, hard ore, run-of-mine feed","es":"Cono secundario, mineral duro, alimentación a granel"},"category":{"en":"Secondary cone","es":"Cono secundario"},"real_or_synthetic":"synthetic","manifest_path":"manifests/S04.json"},{"case_id":"S05","title":{"en":"Cone secondary, fines-heavy feed","es":"Cono secundario, alimentación con muchos finos"},"category":{"en":"Secondary cone","es":"Cono secundario"},"real_or_synthetic":"synthetic","manifest_path":"manifests/S05.json"},{"case_id":"S06","title":{"en":"Cone secondary, trickle feed","es":"Cono secundario, alimentación a goteo"},"category":{"en":"Secondary cone","es":"Cono secundario"},"real_or_synthetic":"synthetic","manifest_path":"manifests/S06.json"},{"case_id":"T01","title":{"en":"Cone tertiary, fine feed","es":"Cono terciario, alimentación fina"},"category":{"en":"Tertiary crushing","es":"Chancado terciario"},"real_or_synthetic":"synthetic","manifest_path":"manifests/T01.json"},{"case_id":"T02","title":{"en":"Cone tertiary, hard ore, closed setting","es":"Cono terciario, mineral duro, abertura cerrada"},"category":{"en":"Tertiary crushing","es":"Chancado terciario"},"real_or_synthetic":"synthetic","manifest_path":"manifests/T02.json"}],"files":["models/surrogate.json","models/surrogate.onnx","models/surrogate.int8.onnx","models/psd-ae.json","models/psd-ae.onnx","hp500/backbone.json","hp500/loo.json","model-metrics.json"]}